{"events":[{"causal_claims":[],"confidence":1.0,"event_id":"EVENT-9dbd6528755e7072d9b6","event_type":"NEWS","evidence_ids":["EV-a1877923c3619b990708","EV-ead0479d72acb1665543"],"headline":"Top S&P 500 Stocks to Watch Next Week: Tesla, Google, Intel, GE Vernova","importance":"UNKNOWN","industry":null,"issuer":null,"numeric_facts":[],"portfolio_relationship":"NOT_OPEN_HOLDING","scheduled_event_time":null,"sector":null,"ticker":"TSLA"},{"causal_claims":[],"confidence":1.0,"event_id":"EVENT-ea4d28ff9ecf756ca873","event_type":"NEWS","evidence_ids":["EV-a1877923c3619b990708","EV-ead0479d72acb1665543"],"headline":"Top S&P 500 Stocks to Watch Next Week: Tesla, Google, Intel, GE Vernova","importance":"UNKNOWN","industry":null,"issuer":null,"numeric_facts":[],"portfolio_relationship":"NOT_OPEN_HOLDING","scheduled_event_time":null,"sector":null,"ticker":"GOOG"},{"causal_claims":[],"confidence":1.0,"event_id":"EVENT-8950cc763a9e02b27519","event_type":"NEWS","evidence_ids":["EV-a1877923c3619b990708","EV-ead0479d72acb1665543"],"headline":"Top S&P 500 Stocks to Watch Next Week: Tesla, Google, Intel, GE Vernova","importance":"UNKNOWN","industry":null,"issuer":null,"numeric_facts":[],"portfolio_relationship":"NOT_OPEN_HOLDING","scheduled_event_time":null,"sector":null,"ticker":"INTC"},{"causal_claims":[],"confidence":1.0,"event_id":"EVENT-4b7615674ad4f95aebf1","event_type":"NEWS","evidence_ids":["EV-a1877923c3619b990708","EV-ead0479d72acb1665543"],"headline":"Top S&P 500 Stocks to Watch Next Week: Tesla, Google, Intel, GE Vernova","importance":"UNKNOWN","industry":null,"issuer":null,"numeric_facts":[],"portfolio_relationship":"NOT_OPEN_HOLDING","scheduled_event_time":null,"sector":null,"ticker":"GEV"},{"causal_claims":[],"confidence":1.0,"event_id":"EVENT-f6f96fb70a220693a260","event_type":"NEWS","evidence_ids":["EV-a1877923c3619b990708","EV-ead0479d72acb1665543"],"headline":"Top S&P 500 Stocks to Watch Next Week: Tesla, Google, Intel, GE Vernova","importance":"UNKNOWN","industry":null,"issuer":null,"numeric_facts":[],"portfolio_relationship":"NOT_OPEN_HOLDING","scheduled_event_time":null,"sector":null,"ticker":"SPCX"},{"causal_claims":[],"confidence":1.0,"event_id":"EVENT-75a8d08cfb3ecdcd8c18","event_type":"NEWS","evidence_ids":["EV-360c4bf906feb648f5e7","EV-ead0479d72acb1665543"],"headline":"Bill Ackman Losing Winning Streak as Pershing Square's Core Holdings Falter","importance":"UNKNOWN","industry":null,"issuer":null,"numeric_facts":[],"portfolio_relationship":"NOT_OPEN_HOLDING","scheduled_event_time":null,"sector":null,"ticker":"PSUS"},{"causal_claims":[],"confidence":1.0,"event_id":"EVENT-cdc7bc3a37854a587d59","event_type":"NEWS","evidence_ids":["EV-360c4bf906feb648f5e7","EV-ead0479d72acb1665543"],"headline":"Bill Ackman Losing Winning Streak as Pershing Square's Core Holdings Falter","importance":"UNKNOWN","industry":null,"issuer":null,"numeric_facts":[],"portfolio_relationship":"NOT_OPEN_HOLDING","scheduled_event_time":null,"sector":null,"ticker":"PS"},{"causal_claims":[],"confidence":1.0,"event_id":"EVENT-f8b523541e63d1a3efea","event_type":"NEWS","evidence_ids":["EV-360c4bf906feb648f5e7","EV-ead0479d72acb1665543"],"headline":"Bill Ackman Losing Winning Streak as Pershing Square's Core Holdings Falter","importance":"UNKNOWN","industry":null,"issuer":null,"numeric_facts":[],"portfolio_relationship":"NOT_OPEN_HOLDING","scheduled_event_time":null,"sector":null,"ticker":"AMZN"},{"causal_claims":[],"confidence":1.0,"event_id":"EVENT-96faba384a7974931147","event_type":"NEWS","evidence_ids":["EV-360c4bf906feb648f5e7","EV-ead0479d72acb1665543"],"headline":"Bill Ackman Losing Winning Streak as Pershing Square's Core Holdings Falter","importance":"UNKNOWN","industry":null,"issuer":null,"numeric_facts":[],"portfolio_relationship":"NOT_OPEN_HOLDING","scheduled_event_time":null,"sector":null,"ticker":"MSFT"},{"causal_claims":[],"confidence":1.0,"event_id":"EVENT-a2dbb0b0b84c8a94c7c9","event_type":"NEWS","evidence_ids":["EV-360c4bf906feb648f5e7","EV-ead0479d72acb1665543"],"headline":"Bill Ackman Losing Winning Streak as Pershing Square's Core Holdings Falter","importance":"UNKNOWN","industry":null,"issuer":null,"numeric_facts":[],"portfolio_relationship":"NOT_OPEN_HOLDING","scheduled_event_time":null,"sector":null,"ticker":"CMG"},{"causal_claims":[],"confidence":1.0,"event_id":"EVENT-a8c9768d958b1237999e","event_type":"NEWS","evidence_ids":["EV-360c4bf906feb648f5e7","EV-ead0479d72acb1665543"],"headline":"Bill Ackman Losing Winning Streak as Pershing Square's Core Holdings Falter","importance":"UNKNOWN","industry":null,"issuer":null,"numeric_facts":[],"portfolio_relationship":"NOT_OPEN_HOLDING","scheduled_event_time":null,"sector":null,"ticker":"BN"},{"causal_claims":[],"confidence":1.0,"event_id":"EVENT-4bb462980195abf1e7b6","event_type":"NEWS","evidence_ids":["EV-a7bc27309d7cf37e75ec","EV-ead0479d72acb1665543"],"headline":"Earnings Season is Booming, So Why Are S&P 500 and Nasdaq 100 Falling?","importance":"UNKNOWN","industry":null,"issuer":null,"numeric_facts":[],"portfolio_relationship":"NOT_OPEN_HOLDING","scheduled_event_time":null,"sector":null,"ticker":"NFLX"},{"causal_claims":[],"confidence":1.0,"event_id":"EVENT-58cdab9e3746475293d9","event_type":"NEWS","evidence_ids":["EV-a7bc27309d7cf37e75ec","EV-ead0479d72acb1665543"],"headline":"Earnings Season is Booming, So Why Are S&P 500 and Nasdaq 100 Falling?","importance":"UNKNOWN","industry":null,"issuer":null,"numeric_facts":[],"portfolio_relationship":"NOT_OPEN_HOLDING","scheduled_event_time":null,"sector":null,"ticker":"IBM"},{"causal_claims":[],"confidence":1.0,"event_id":"EVENT-ef001dd75ed3b04471bb","event_type":"NEWS","evidence_ids":["EV-a7bc27309d7cf37e75ec","EV-ead0479d72acb1665543"],"headline":"Earnings Season is Booming, So Why Are S&P 500 and Nasdaq 100 Falling?","importance":"UNKNOWN","industry":null,"issuer":null,"numeric_facts":[],"portfolio_relationship":"NOT_OPEN_HOLDING","scheduled_event_time":null,"sector":null,"ticker":"FDS"},{"causal_claims":[],"confidence":1.0,"event_id":"EVENT-2f502fcae9fefe8dfdbf","event_type":"SECTOR_SNAPSHOT","evidence_ids":["EV-928d462999719cdf0436","EV-ead0479d72acb1665543"],"headline":"TECH","importance":"UNKNOWN","industry":null,"issuer":null,"numeric_facts":[{"name":"price","unit":"USD/share","value":175.59},{"name":"change_pct","unit":"percent","value":-1.0872014420910359},{"name":"rsi","unit":"index_points","value":42.43262942102985}],"portfolio_relationship":"NOT_OPEN_HOLDING","scheduled_event_time":null,"sector":"TECH","ticker":"XLK"},{"causal_claims":[],"confidence":1.0,"event_id":"EVENT-78ec8e7742b45c24ebb6","event_type":"SECTOR_SNAPSHOT","evidence_ids":["EV-03a16060fa294ac517be","EV-ead0479d72acb1665543"],"headline":"FINANCIALS","importance":"UNKNOWN","industry":null,"issuer":null,"numeric_facts":[{"name":"price","unit":"USD/share","value":56.26},{"name":"change_pct","unit":"percent","value":-0.8634361233480211},{"name":"rsi","unit":"index_points","value":65.37277312116264}],"portfolio_relationship":"NOT_OPEN_HOLDING","scheduled_event_time":null,"sector":"FINANCIALS","ticker":"XLF"},{"causal_claims":[],"confidence":1.0,"event_id":"EVENT-bc6780f7d8e4aa64e9f8","event_type":"SECTOR_SNAPSHOT","evidence_ids":["EV-cf3d87ce4840341ebabd","EV-ead0479d72acb1665543"],"headline":"ENERGY","importance":"UNKNOWN","industry":null,"issuer":null,"numeric_facts":[{"name":"price","unit":"USD/share","value":57.68},{"name":"change_pct","unit":"percent","value":1.1574886004910496},{"name":"rsi","unit":"index_points","value":61.405279108391625}],"portfolio_relationship":"NOT_OPEN_HOLDING","scheduled_event_time":null,"sector":"ENERGY","ticker":"XLE"},{"causal_claims":[],"confidence":1.0,"event_id":"EVENT-876bef8a6f0878bf6ab1","event_type":"SECTOR_SNAPSHOT","evidence_ids":["EV-94d64c5a624c3f11c9cc","EV-ead0479d72acb1665543"],"headline":"HEALTHCARE","importance":"UNKNOWN","industry":null,"issuer":null,"numeric_facts":[{"name":"price","unit":"USD/share","value":161.09},{"name":"change_pct","unit":"percent","value":-0.4388133498145908},{"name":"rsi","unit":"index_points","value":58.15454727419796}],"portfolio_relationship":"NOT_OPEN_HOLDING","scheduled_event_time":null,"sector":"HEALTHCARE","ticker":"XLV"},{"causal_claims":[],"confidence":1.0,"event_id":"EVENT-e2c547402f6ee3615f25","event_type":"SECTOR_SNAPSHOT","evidence_ids":["EV-90f59ca559fe34d435af","EV-ead0479d72acb1665543"],"headline":"INDUSTRIALS","importance":"UNKNOWN","industry":null,"issuer":null,"numeric_facts":[{"name":"price","unit":"USD/share","value":179.41},{"name":"change_pct","unit":"percent","value":-0.41076880377463726},{"name":"rsi","unit":"index_points","value":48.78845258260023}],"portfolio_relationship":"NOT_OPEN_HOLDING","scheduled_event_time":null,"sector":"INDUSTRIALS","ticker":"XLI"},{"causal_claims":[],"confidence":1.0,"event_id":"EVENT-4b0c1f0007e53fba9ee3","event_type":"SECTOR_SNAPSHOT","evidence_ids":["EV-c28a5e365e3c4712f059","EV-ead0479d72acb1665543"],"headline":"CONSUMER_DISCRETIONARY","importance":"UNKNOWN","industry":null,"issuer":null,"numeric_facts":[{"name":"price","unit":"USD/share","value":115.44},{"name":"change_pct","unit":"percent","value":-1.6192261803306678},{"name":"rsi","unit":"index_points","value":46.32617152572439}],"portfolio_relationship":"NOT_OPEN_HOLDING","scheduled_event_time":null,"sector":"CONSUMER_DISCRETIONARY","ticker":"XLY"},{"causal_claims":[],"confidence":1.0,"event_id":"EVENT-ea35eda96ead0a6db2cd","event_type":"SECTOR_SNAPSHOT","evidence_ids":["EV-af53a7fc6a7b64299461","EV-ead0479d72acb1665543"],"headline":"CONSUMER_STAPLES","importance":"UNKNOWN","industry":null,"issuer":null,"numeric_facts":[{"name":"price","unit":"USD/share","value":85.19},{"name":"change_pct","unit":"percent","value":-0.7225265120615365},{"name":"rsi","unit":"index_points","value":54.53663772515471}],"portfolio_relationship":"NOT_OPEN_HOLDING","scheduled_event_time":null,"sector":"CONSUMER_STAPLES","ticker":"XLP"},{"causal_claims":[],"confidence":1.0,"event_id":"EVENT-